{
  "claims": {
    "basefold_joint_simulator_proved": false,
    "compiled_full_m4": false,
    "complete_zk": false,
    "joint_simulator_proved": false,
    "outer_spartan_simulator_proved": false,
    "qrom_composed": false,
    "strict_pq128": false
  },
  "decision": {
    "conditional_repair": "Preferred: remove the component precommit claim and prove one grouped precommit+private relation. Control: one fresh unused h closes the one direct clear functional only if d is forced nonzero; rank-r exposure needs blinder rank r.",
    "frontier_eligible": false,
    "reason_codes": [
      "OUTER_PRECOMMIT_CORRELATION_LEAK",
      "EXACT_MULTIPLICITIES_UNCOMPILED",
      "BASEFOLD_JOINT_SIMULATOR_OPEN",
      "OUTER_SPARTAN_SIMULATOR_OPEN",
      "QROM_COMPOSITION_OPEN",
      "STRICT_E384_BACKEND_OPEN"
    ],
    "status": "REJECT_CURRENT_PATCH_REPAIR_CONDITIONAL"
  },
  "inventory": {
    "exact_multiplicities_complete": false,
    "items": [
      {
        "id": "PUBLIC_CONTEXT",
        "message": "statement and transcript preamble",
        "multiplicity": "fixed by 912-byte transport and wrapper context",
        "phase": "context",
        "protection": "none_required",
        "witness_dependency": "public_only"
      },
      {
        "id": "COMMIT_K",
        "message": "Merkle commitment to outer precommit K",
        "multiplicity": "one oracle",
        "phase": "pre_challenge",
        "protection": "BaseFold is_zk vector mask",
        "witness_dependency": "mask_only_but_later_correlated"
      },
      {
        "id": "COMMIT_SHIFTED_TRACE",
        "message": "commitment to pi + k_trace*1",
        "multiplicity": "one and first/only inner oracle",
        "phase": "pre_challenge",
        "protection": "constant shift plus independent BaseFold vector mask",
        "witness_dependency": "direct"
      },
      {
        "id": "INNER_PRIVATE_FIELD_STREAM",
        "message": "every send_one/send_many field message E_j=m_j+k_j",
        "multiplicity": "symbolic; exact count requires compiled 83-Keccak wrapper",
        "phase": "inner_m4",
        "protection": "fresh precommitted OTP per scalar",
        "witness_dependency": "direct_or_derived"
      },
      {
        "id": "INNER_PUBLIC_CLAIM_STREAM",
        "message": "send_public_claim values",
        "multiplicity": "symbolic",
        "phase": "inner_m4",
        "protection": "clear; semantic classification must be audited",
        "witness_dependency": "declared_public_by_call_site"
      },
      {
        "id": "MASKED_TRACE_CLAIM",
        "message": "M=s+k_trace*c",
        "multiplicity": "exactly one",
        "phase": "inner_ring_switch",
        "protection": "rank-one mask with fixed-shape c!=0 sampler",
        "witness_dependency": "direct"
      },
      {
        "id": "OUTER_PRIVATE_COMMITMENT",
        "message": "commitment to replay/private witness",
        "multiplicity": "one oracle",
        "phase": "outer_spartan",
        "protection": "BaseFold is_zk vector mask and Spartan blinding",
        "witness_dependency": "direct"
      },
      {
        "id": "OUTER_LIBRA_MASK_COMMITMENT",
        "message": "commitment to random Libra coefficients",
        "multiplicity": "one oracle",
        "phase": "outer_spartan",
        "protection": "BaseFold is_zk vector mask",
        "witness_dependency": "mask_only"
      },
      {
        "id": "OUTER_LIBRA_TRANSCRIPT",
        "message": "mask_eval, batched round coefficients, mask_eval_out",
        "multiplicity": "depends on compiled outer constraint tier",
        "phase": "outer_spartan",
        "protection": "Libra masking; theorem and zero-batch-challenge case open",
        "witness_dependency": "joint witness_and_mask"
      },
      {
        "id": "OUTER_ENDPOINT_EVALUATIONS",
        "message": "a_eval, b_eval, c_eval",
        "multiplicity": "three scalars",
        "phase": "outer_spartan",
        "protection": "claimed Spartan dummy/blinding distribution; simulator open",
        "witness_dependency": "direct_linear_evaluations"
      },
      {
        "id": "OUTER_PRECOMMIT_CLEAR_CLAIM",
        "message": "precommit_claim=<K,T_K>",
        "multiplicity": "one direct precommit-oracle functional",
        "phase": "outer_spartan",
        "protection": "none in frozen patch",
        "witness_dependency": "mask_only_in_isolation_but_correlated_with_OTP_stream"
      },
      {
        "id": "BASEFOLD_MASK_INNER_PRODUCTS",
        "message": "sigma_i=<omega_i,T_i> for every is_zk oracle",
        "multiplicity": "one per ZK oracle after relation batching",
        "phase": "combined_basefold",
        "protection": "must be handled by joint BaseFold simulator",
        "witness_dependency": "mask_only_but_jointly_correlated"
      },
      {
        "id": "BASEFOLD_MASKED_SUMCHECK",
        "message": "masked sumcheck rounds and alpha_i evaluations",
        "multiplicity": "one alpha per committed oracle plus tier-dependent rounds",
        "phase": "combined_basefold",
        "protection": "gamma folding; gamma=0 and dependent-functional cases not gated",
        "witness_dependency": "joint witness_and_mask"
      },
      {
        "id": "FRI_FOLD_COMMITMENTS",
        "message": "fold-round roots and terminal committed vector",
        "multiplicity": "parameter-dependent",
        "phase": "combined_fri",
        "protection": "joint PCS/FRI simulator required",
        "witness_dependency": "joint witness_and_mask"
      },
      {
        "id": "MERKLE_QUERY_OPENINGS",
        "message": "queried leaves, fold cosets, and authentication nodes",
        "multiplicity": "parameter-dependent",
        "phase": "combined_fri",
        "protection": "query-conditioned BaseFold/FRI hiding theorem required",
        "witness_dependency": "joint witness_and_mask"
      }
    ],
    "protocol_class_complete": true
  },
  "rank_audit": {
    "all_expectations_met": true,
    "coefficient_c_hex": "cd4d43d7b25354b85ec3253d27bcc000",
    "conditional_grouped_relation_clear_rank_closed": true,
    "conditional_rank_one_repair_clear_rank_closed": true,
    "constructive_c_nonzero_pass": true,
    "constructive_repair_pass": true,
    "constructive_trials": 64,
    "criterion": "rank(R) == rank([R|W])",
    "current_patch_clear_rank_closed": false,
    "direct_precommit_functional_rank": 1,
    "field": "GF(2^128)/(x^128+x^7+x^2+x+1)",
    "grouped_relation_feasibility": {
      "delta_basis": "remove the one clear B128 precommit_claim; retain commitments, sigma_i, Phase-A round width, per-oracle alphas, and Phase-B FRI topology",
      "exact_delta_measured": false,
      "existing_phase_a_can_express_cross_oracle_group": false,
      "predicted_serialized_delta_bytes": -16,
      "reason": "The pinned queue is indexed per oracle, constructs one sumcheck prover per oracle, and requires a component claim for each. Phase B is multi-oracle but begins only after those component claims have already been reduced.",
      "required_refactor": [
        "add a queued relation group spanning precommit and private oracle indices",
        "mask the public total with the sum of their independent sigma_i values",
        "run one shared Phase-A sumcheck at the maximum member domain",
        "return one alpha per member oracle for the unchanged combined FRI Phase B",
        "mirror the exact grouped relation in the verifier"
      ]
    },
    "repair_coefficient_d_hex": "7bd56de87ef6f6044109a237480daaeb",
    "repair_comparison": {
      "grouped": "removes the leaking component functional, needs no new blinder or nonzero-d abort gate, and should save one 16-byte scalar, but requires a cross-oracle Phase-A relation refactor",
      "recommended": "grouped_precommit_private_relation",
      "unused_blinder_h": "closes exactly rank one with d!=0 and is a useful control, but retains the component claim, adds a precommit coordinate/constraint and paired sampler, and needs one fresh blinder per independent clear-claim rank"
    },
    "repair_scope": "Only the isolated direct precommit scalar. Outer Libra endpoints, BaseFold sigma/alpha, FRI, Merkle queries, nonlinear composition, and QROM remain open.",
    "scenarios": {
      "basefold_dependent_functionals": {
        "combined_rank": 2,
        "contained": false,
        "expectation_met": true,
        "expected": false,
        "mask_columns": 3,
        "mask_rank": 1,
        "observations": 2,
        "witness_columns": 3
      },
      "basefold_gamma_zero": {
        "combined_rank": 2,
        "contained": false,
        "expectation_met": true,
        "expected": false,
        "mask_columns": 3,
        "mask_rank": 1,
        "observations": 2,
        "witness_columns": 3
      },
      "basefold_generic_independent_functionals": {
        "combined_rank": 2,
        "contained": true,
        "expectation_met": true,
        "expected": true,
        "mask_columns": 3,
        "mask_rank": 2,
        "observations": 2,
        "witness_columns": 3
      },
      "current_patch_clear_precommit_claim": {
        "combined_rank": 11,
        "contained": false,
        "expectation_met": true,
        "expected": false,
        "mask_columns": 10,
        "mask_rank": 10,
        "observations": 11,
        "witness_columns": 9
      },
      "grouped_precommit_private_total_claim": {
        "combined_rank": 10,
        "contained": true,
        "expectation_met": true,
        "expected": true,
        "mask_columns": 10,
        "mask_rank": 10,
        "observations": 10,
        "witness_columns": 9
      },
      "ideal_c_nonzero_fresh_masks": {
        "combined_rank": 10,
        "contained": true,
        "expectation_met": true,
        "expected": true,
        "mask_columns": 10,
        "mask_rank": 10,
        "observations": 10,
        "witness_columns": 9
      },
      "missing_basefold_vector_mask": {
        "combined_rank": 9,
        "contained": false,